unit_id,article_title,text,source,date,location,label,,,,
1914947530,Syria attack symptoms consistent with nerve agent use WHO,"Wed 05 Apr 2017 Syria attack symptoms consistent with nerve agent use WHO. Victims of a suspected chemical attack in Syria appeared to show symptoms consistent with reaction to a nerve agent the World Health Organization said on Wednesday. ""Some cases appear to show additional signs consistent with exposure to organophosphorus chemicals a category of chemicals that includes nerve agents"" WHO said in a statement putting the death toll at at least 70. The United States has said the deaths were caused by sarin nerve gas dropped by Syrian aircraft. Russia has said it believes poison gas had leaked from a rebel chemical weapons depot struck by Syrian bombs. Sarin is an organophosporus compound and a nerve agent. Chlorine and mustard gas which are also believed to have been used in the past in Syria are not. A Russian Defence Ministry spokesman did not say what agent was used in the attack but said the rebels had used the same chemical weapons in Aleppo last year. The WHO said it was likely that some kind of chemical was used in the attack because sufferers had no apparent external injuries and died from a rapid onset of similar symptoms including acute respiratory distress. It said its experts in Turkey were giving guidance to overwhelmed health workers in Idlib on the diagnosis and treatment of patients and medicines such as Atropine an antidote for some types of chemical exposure and steroids for symptomatic treatment had been sent. A U.N. Commission of Inquiry into human rights in Syria has previously said forces loyal to Syrian President Bashar al-Assad have used lethal chlorine gas on multiple occasions. Hundreds of civilians died in a sarin gas attack in Ghouta on the outskirts of Damascus in August 2013. Assads government has always denied responsibility for that attack. Syria agreed to destroy its chemical weapons in 2013 under a deal brokered by Moscow and Washington. But Russia a Syrian ally and China have repeatedly vetoed any United Nations move to sanction Assad or refer the situation in Syria to the International Criminal Court. ""These types of weapons are banned by international law because they represent an intolerable barbarism"" Peter Salama Executive Director of the WHO Health Emergencies Programme said in the WHO statement. - REUTERS",nna,04/05/2017,idlib,0,,,,
1914947532,Homs governor says U.S. attack caused deaths but doesnt see big human losses,"Fri 07 Apr 2017 at 0914 Homs governor says U.S. attack caused deaths but doesnt see big human losses. A U.S. missile strike on an airbase near the Syrian city of Homs on Friday caused deaths but is not believed to have resulted in ""big human casualties"" Homs Governor Talal Barazi said. Barazi said the attack served the interests of ""armed terrorist groups"" including Islamic State adding that the targeted airbase had been providing air support for army operations against Islamic State east of Palmyra. Barazi was speaking in a series of phone interviews with media on Friday. He confirmed deaths at the airbase in a phone interview with Lebanese TV station al-Mayadeen. ""I believe - God willing - that the human casualties are not big but there is material damage. We hope there are not many victims and martyrs"" he told Reuters by telephone. Speaking at dawn he said rescue and fire-fighting operations had been going on for two hours at the base. He said the attack was a form of ""support for the armed terrorist groups and it is an attempt to weaken the capabilities of the Syrian Arab Army to combat terrorism"". Speaking to Syrian state TV Barazi said ""The Syrian leadership and Syrian policy will not change. ""This targeting was not the first and I dont believe it will be the last"" he added. In separate comments to al-Mayadeen he said ""The war against terrorism will continue."" U.S. President Donald Trump said he ordered missile strikes against an airfield from which a deadly chemical weapons attack was launched this week declaring he acted in Americas ""national security interest"" against Syrian President Bashar al-Assad. U.S. officials said the military fired dozens of cruise missiles against the base in response to the suspected gas attack in a rebel-held area that Washington has blamed on Assads forces. The Syrian government has strongly denied responsibility. The U.S. strikes ""targeted military positions in Syria and in Homs specifically"" in order to publicly ""serve the goals of terrorism in Syria and the goals of Israel in the long run"" Barazi added in his interview with state TV.-REUTERS",nna,04/07/2017,homs,0,,,,
1914947533,Death toll from Aleppo bomb attack at least 112,Sun 16 Apr 2017 Death toll from Aleppo bomb attack at least 112. The death toll from a bomb blast on a crowded Syrian bus convoy outside Aleppo reached at least 112 people the Syrian Observatory for Human Rights monitoring group said on Sunday. Syrian rescue workers the Civil Defence said that they had carted away at least 100 bodies from the site of Saturdays blast which hit buses carrying Shiite residents as they waited to cross from rebel into government territory in an evacuation deal between warring sides. The British-based Observatory said the number was expected to rise. Those killed were mostly residents of the villages of al-Foua and Kefraya in Idlib province but included rebel fighters guarding the convoy the Observatory said. There was no immediate claim of responsibility for the attack which pro-Damascus media said was carried out by a suicide car bomber. The convoy was carrying at least 5000 people including civilians and several hundred pro-government fighters who were granted safe passage out of the two Shiite villages which are besieged by rebels. Under the evacuation deal more than 2000 people including rebel fighters were granted safe passage out of Madaya a town near Damascus besieged by government forces and their allies. That convoy was waiting at a bus garage in a government-held area on Aleppos outskirts a few miles from where the attack took place. Madaya evacuees said they heard the blast. --Reuters,nna,4/16/2017,aleppo,0,,,,
1914947534,Aleppo bomb blast kills six Syrian state TV,Wed 19 Apr 2017 Aleppo bomb blast kills six Syrian state TV. A bomb blast killed six people and injured 32 in the Salah al-Din district of Aleppo Syrian state television reported on Wednesday without giving further details. Salah al-Din is located west of Aleppos Old City in a district that was part of the last rebel enclave there until it was taken over by the Syrian army in an advance in December. --Reuters,nna,4/19/2017,aleppo,0,,,,
1914947535,29 Syria Rebels Dead in Fighting for Key Aleppo Road,Sun 10 Jul 2016 29 Syria Rebels Dead in Fighting for Key Aleppo Road. At least 29 Syrian rebels were killed in clashes with regime troops overnight during a failed bid to reopen the oppositions key supply route into Aleppo city a monitor said Sunday. The fighters from the Faylaq al-Sham Islamist faction and Al-Qaeda affiliate Al-Nusra Front were killed trying to reopen the Castello Road which regime forces effectively severed on Thursday the Syrian Observatory for Human Rights monitor said.--AFP,nna,07/10/2016,aleppo,0,,,,
1914947536,Suicide bombing kills at least 16 in northeast Syria,Tue 05 Jul 2016 Suicide bombing kills at least 16 in northeast Syria. A suicide bomb blast killed at least 16 people in the mostly Kurdish-controlled city of Hasaka in northeastern Syria on Tuesday the monitoring group the Syrian Observatory for Human Rights said. The attacker detonated his explosives at a bakery. The British-based observatory said several other people were wounded and the death toll was likely to rise because of the number of serious injuries. There was no immediate claim of responsibility for the bombing. Islamic State has targeted areas of Hasaka province in the past including another city Qamishli. But bomb attacks in Hasaka city itself have been rarer in recent months. The Kurdish YPG militia which controls most of Hasaka province captured large areas of territory from Islamic State in northeastern Syria last year and is involved in a U.S.-backed offensive against the jihadists further west near the Turkish border. --Reuters,nna,07/05/2016,hasakeh,0,,,,
1914947537,22 dead in heavy U.S. raids on IS Syria stronghold,"Sun 05 Jul 2015 22 dead in heavy U.S. raids on IS Syria stronghold. Six civilians including a child were among at least 22 people killed in U.S. air strikes on the Islamic State groups de facto Syrian capital on Saturday and Sunday a monitor said. The rest of the dead in the raids on the city of Raqa were IS fighters the Syrian Observatory for Human Rights said. Dozens of people were also wounded. The U.S.-led coalition which launched an air war against IS in Syria last September said it had carried out ""significant"" air strikes against Raqa. ""The significant air strikes tonight were executed to deny Daesh (IS) the ability to move military capabilities throughout Syria and into Iraq"" spokesman Lieutenant Colonel Thomas Gilleran said. ""This was one of the largest deliberate engagements we have conducted to date in Syria and it will have debilitating effects on Daeshs ability to move from Raqa."" Coalition forces ""successfully engaged multiple targets"" throughout Raqa the statement said destroying IS structures and transit routes. The strikes ""have severely constricted terrorist freedom of movement"" it added. Washington is leading a coalition fighting IS in Syria and Iraq where the extremist group has proclaimed an Islamic ""caliphate"" in territory under its control. The group emerged in Syria in 2013 and now controls around half the countrys territory though much of the land it holds is unpopulated desert. More than 230000 people have been killed in Syria since the conflict began in March 2011.-AFP",nna,07/05/2015,raqqa,0,,,,Fake = 0
1914947538,Suicide bomber kills 4 in Assad clans hometown,"Sun 22 Feb 2015 Suicide bomber kills 4 in Assad clans hometown. A suicide bomber driving an ambulance killed four people on Sunday in an unprecedented attack on a hospital that took Syrias civil war to the ruling Assad clans hometown for the first time a monitoring group said. The attack came as the Syrian Observatory for Human Rights reported that troops had executed 48 people earlier this week in a northern village among them 10 children. ""A man drove an ambulance packed with explosives into the parking of the Qardaha hospital. Another man was in the vehicle with him but it was unclear whether he was an accomplice or a hostage. Four people were killed in the attack"" said Observatory director Rami Abdel Rahman. Earlier state television had reported the blast but did not specify the nature of the attack. The attack the first explosion to hit the heart of the western town since the outbreak of Syrias civil war in 2011 killed a nurse a hospital employee and two soldiers said Observatory director Abdel Rahman. The outskirts of Qardaha have previously come under rocket fire while Latakia province - where the town is located - has seen several rounds of heavy fighting. A mausoleum containing the graves of President Bashar Assads father and predecessor Hafez and brother Bassil is located in Qardaha. The clan has ruled Syria with an iron fist for more than 40 years. Syrias war began in March 2011 as a pro-democracy revolt seeking Assads ouster. It morphed into a conflict after the regime unleashed a brutal crackdown on dissent. - Troops kill 10 children - Meanwhile the Observatory said 10 children and 13 rebels were among 48 people executed by government forces in the northern village of Rityan earlier this week. The killings took place after troops entered the town Tuesday during an offensive aimed at cutting rebel supply lines to the Turkish border. Abdel Rahman said all the dead were from six families. ""There was no resistance except in one house where a rebel opened fire at troops before being executed along with his family."" The brief seizure of Rityan was part of an abortive army offensive this week to encircle the rebel-held east of Aleppo and relieve two besieged Shiite villages to its north. By Friday all but one of the villages taken by government forces had been recaptured by the rebels who include fighters from Al-Qaeda affiliate Al-Nusra Front. The heavy fighting claimed the lives of 129 loyalists and 116 rebels including an Al-Nusra commander according to an Observatory toll. - Air raids kill thousands - While the ground offensive failed warplanes kept pounding rebel areas of Aleppo city and other parts of the country. On Saturday two women and two children were among eight people killed when a barrel bomb hit a building in an opposition-held area of Aleppo city once Syrias commercial capital. Six people were also reported killed in rebel shelling of regime-held areas of the city. The air force also killed at least 10 people in rebel areas east of Damascus Saturday the Observatory said. According to the group they were the latest of more than 7000 people killed across Syria since the UN Security Council passed a resolution last year ordering an end to sieges and indiscriminate use of weapons in populated areas. The Observatory ""has documented the killing of 5812 civilians including 1733 children 969 women and 3110 men in barrel bombings and (other) air raids"" over the past year. Meanwhile rebel fire on regime-held areas killed 1102 people said the Observatory adding that 234 of them were children. And 313 people died in areas under army siege in the past year as a result of food and medical shortages despite the fact that the resolution also ordered the lifting of sieges.-AFP",nna,2/22/2015,lattakia,0,,,,True = 1
1914947539,Explosion rocks down town Damascus,Sun 01 Feb 2015 Explosion rocks down town Damascus . An explosion inside a bus killed six people and injured another ten in down town Damascus according to preliminary reports on Sunday. Syrias government run TV said the explosion took place in Al Kalassa region of the Syrian capital and that 19 people were injured and an unspecified number of others killed.,nna,02/01/2015,damascus,1,,,,
1914947540,Damascus explosion due to rocket bomb,Sat 24 Aug 2013 Damascus explosion due to rocket bomb . The blast heard Saturday evening in the area of Burj Rouss Qsaa in the Syrian Capital Damascus was due to a rocket bomb and not a car explosion NNA correspondent reported. The rocket bomb packed with heavy explosive material led to the killing of one person and the injury of 40 others; in addition to causing huge material damages within the area of explosion NNA correspondent added quoting the Syrian National Television.,nna,8/24/2013,damascus,0,,,,
1915433669,Syrian regime steps up aerial assault on Douma,"12 February 2015 Casualties mount in the Eastern Ghouta city as the regime continues its assault for the tenth day in a row. More than 120 people have been killed as troops allied to the Syrian regime stepped up attacks on Syrias Eastern Ghouta governorate focusing on the city of Douma around 10km northeast of Damascus. Regime aircraft have dropped more than 1000 bombs on the city in at least 150 airstrikes during the past ten days according to analysts. ""Rescue teams and volunteers continue to search for survivors and bodies under the rubble amid the mass destruction of neighbourhoods"" Osama Said a Douma-based media activist told al-Araby al-Jadeed. At least 400 people - mainly women and children - have been injured during this bombing campaign and 500 residential buildings have been destroyed according to the citys monitoring and documentation office. Retaliation The administration of President Bashar al-Assad said attacks had been ramped up after Zahran Alloush leader of the Army of Islam - a merged collection of rebel opposition groups - declared Damascus a military zone [Ar] and shot hundreds of missiles at the capital. 	 	Rescue teams and volunteers continue to search for survivors and bodies. - Osama Said media activist The latest escalation is also an attempt by regime forces to break into Eastern Ghouta which is controlled by the Army of Islam. Douma-based activists have drawn the worlds attention to their tragedy using the hashtag Doumaexterminated and its Arabic equivalent. Pictures and videos of the city posted using the hashtag have shown dozens of severely injured children receiving treatment at makeshift hospitals as well as injured civilians and dead bodies being pulled from the rubble. ""Pictures from Douma and the high civilian body count show the regime is targeting residential areas not military sites"" said Hisham Marwah the Syrian National Coalitions (SNC) vice-president. The regime has used this policy of collective punishment in many parts of Syria since the uprising began he added. Marwah called on the international community to put pressure on Assads regime to stop the massacres immediately. ""The international alliance should add Assads positions to the locations it is targeting in its attacks on the Islamic State group in Syria"" he added. Other locations targeted by Assads troops this week in Eastern Ghouta include the towns of Misraba Ayn Tarma Arbin and Kafr Batna and the al-Wafideen refugee camp. This article is an edited translation from our Arabic edition. Also",alaraby,02/12/2015,damascus,1,,,,
1915433670,Hizballah leads regime offensive in southern Syria,"12 February 2015 Free Syrian Army and Nusra Front fighters pushed from town of Deir al-Adas and surrounding areas as rebels claim Iranian-backed Lebanese group wants to set up permanent base. Hizballah fighters backed by Syrian and Iranian forces have pushed the Nusra Front and from the town of Deir al-Adas reports say in a major offensive in the Daraa governorate. The London-based Syrian Observatory for Human Rights said Deir al-Adas was taken on Tuesday after two days of fierce fighting between regime elements and rebels including members of Nusra al-Qaedas affiliate in Syria and fighters from the Free Syrian Army. The offensive is part of the operation launched on Sunday to seize areas at the intersection point of the three Syrian governorates of Rif Dimashq Daraa and Quneitra near the disputed Golan Heights. The observatory group said 20 opposition fighters were killed in the fighting including a Hizballah ambush near Deir al-Adas. The groups director Rami Abdulrahman told the AFP news agency that Hizballah was leading the attack on Deir al-Adas and its surrounding hills. Al-Araby al-Jadeed cannot independently verify the reports. Restoring security The official Syrian news agency Sana quoted a military source on Wednesday as saying the army was able to ""restore security"" to Sanei Tal al-Hawa and Tal-Arous in the southwestern countryside of Damascus Tal Meri west of Damascus and al-Danaji and Tal Antar near Deir al-Adas. The opposition Local Coordination Committee of Deir al-Adas said heavy shelling had forced the Free Syrian Army from the town which was now ""in range of their firepower"". Ayman al-Aasmi a member of the FSA southern front command claimed that Hizballah was trying to set up a permanent base in north Daraa to link its positions in southern Lebanon through the hills of Mount Hermon. ""The issue is not just about retaking some towns and hills"" he said. ""Hizballah pushed large forces into the battle mostly made up of Lebanese and Iraqi militias in light of the regime forces collapse in the Daraa governorate as a result of losses in battles with opposition forces defections or redeployment into the hot spots in other governorates."" This article is an edited translation of the original Arabic.",alaraby,02/12/2015,damascus,1,,,,
1915433675,Syrian opposition remains divided,"23 February 2015 The Sawaiq al-Rahman Brigade has announced it has killed several Nusra Front fighters as clashes between opposition groups continue. Tags Syria Free Syrian Army opposition groups Sawaiq al-Rahman brigade al-Nusra Front Idlib The Sawaiq al-Rahman brigade announced on Monday that it had killed six Nusra Front fighters and injured several others in the countryside south of Idlib in northwest Syria. The brigade is a Syrian opposition faction affiliated with the Free Syrian Army (FSA). ""The operation was carried out in response to al-Nusras attack on the town of Amiriyah when it set fire to several houses - including one belonging to Mithqal al-Abdallah a former Syrian Revolutionary Front (SRF) commander"" the Sawaiq al-Rahman brigade stated. 	 	Al-Nusra has many enemies. It also has many hostages including my son. - Col Haitham Afisi former FSA deputy chief of staff The brigade also recently killed Abu Hassan an al-Nusra leader in the town of Salqin in the countryside around Idlib. He was hanged for ""violations committed by al-Nusra against the towns civilians"" according to a statement issued by the brigade. The FSAs special forces seventh division also issued a statement giving al-Nusra 48 hours to release those it took hostage nearly a week ago when it stormed its headquarters in the town of Ain Larouz. Those taken include the divisions commander and several fighters. The statement also called on al-Nusra to return all possessions it had taken and to abide by ""the law of God"" to prevent further bloodshed. Former FSA Deputy Chief of Staff Colonel Haitham Afisi said that over the past eight months al-Nusra had also attacked fighters from groups including the FSA SRF Hazzm Maarat al-Noman martyrs brigade Idlib martyrs brigade and those led by Mithal al-Abdallah and Yusuf al-Hassan. ""Al-Nusra has many enemies. It also has many hostages including my son a brigade commander that has been detained for over four months"" Afisi told al-Araby al-Jadeed. The colonel said the group had lost popular support and become a target itself while that those it had attacked were likely to unite against it. The Nusra Front is an al-Qaeda franchise operating in Syria and Lebanon that aims to overthrow the regime of President Assad in Syria. The group has been designated ""a terrorist organisation"" by many western governments. In early November 2014 al-Nusra started expanding into the countryside around Idlib after clashing with other opposition factions particularly the SRF. Al-Nusra has since seized control of most of the countryside south of Idlib the provincial capital. This article is an edited translation from our Arabic edition.",alaraby,2/23/2015,idlib,1,,,,
1915433682,IS video shows murder of 2 Syrian activists,"6 July 2015 So called Islamic State group has posted online a new disturbing video showing the murder of two Syrian activists after they confess to spying. Tags Syria Islamic State activists murder video Palmyra The Islamic State group has released a new video purporting to show the killing of two Syrian activists in the militants stronghold of Raqqa allegedly for spying on the extremists. IS has killed hundreds of people since it declared an Islamic caliphate in June last year with the city of Raqqa as its de facto capital. The video which was posted Monday on an IS-linked Facebook page shows two young men in orange jumpsuits who say they filmed and photographed IS-held areas in Syria and sent footage to a person abroad. They identify themselves as 21-year-old Faysal Hussein Habibi and 20-year-old Bishr Abdul-Azim. They are then tied to a tree after which masked gunmen shoot them in the head at close range. This follows the release of a video posted online n 4 July purportedly showing Islamic State fighters killing 25 Syrian soldiers in the historic town of Palmyra in central Syria. 	 	Scores of Syrian troops and state employees were killed in the days after Palmyra fell to IS. The video showed the soldiers being taken in pickup trucks from the towns notorious Tadmur prison to the amphitheatre. At the theatre they were shot dead by young IS members armed with pistols. Hundreds of people were seen watching the killings. The video did not indicate when the killings took place. The Britain-based Syrian Observatory for Human Rights said these shootings took place on 27 May. It was reported in May that scores of Syrian troops and state employees were murdered in the days after the town fell to IS on 22 May 2015. Palmyra is a UNESCO world heritage site famous for its 2000-year-old Roman colonnades other ruins and priceless artifacts. The capture of Palmyra has raised concern that the militants might try to destroy one of the Middle Easts most spectacular archaeological sites a well-preserved Roman-era city on the towns edge as they have destroyed other pre-Islamic ancient monuments elsewhere in Syria and Iraq. On 2 July IS said its militants had destroyed six archaeological pieces from Palmyra that were confiscated from a smuggler. The shootings in the video took place inside the archaeological site and the troops some of whom had bruises and blood on their faces apparently as a result of being beaten were made to kneel in front of a giant IS black flag before being shot in the back of their heads.",alaraby,07/06/2015,raqqa,1,,,,
