unit_id,article_title,text,source,date,location,label,,,,
1924058058,At least 70 killed in north of Syrias Aleppo monitor | Jordan Times,Last updated at Jul 012016 BEIRUT At least 70 regime and rebel fighters have been killed in 24 hours in a government assault and an extremist-led counterattack in northern Syria a monitor said Thursday. The Syrian Observatory for Human Rights said 30 regime soldiers and 39 rebel fighters had been killed in battles around Al Maleh north of Aleppo since Wednesday afternoon. Extremists fighting for Al Nusra Front the Syrian branch of Al Qaeda were also killed said observatory head Rami Abdel Rahman who did not provide a precise number. The government of President Bashar Assad has been attempting to seize Al Maleh for more than two years. His forces have been trying for months to surround Aleppo by cutting supply lines between rebel-held districts of the city and nearby Turkey which supports opposition forces. For nearly a week regime troops backed by Syrian and Russian warplanes have been battling for control of Al Maleh. Assads regime is also attempting to cut the Castello Road a key supply route from the Turkish border to rebel-held eastern suburbs of Aleppo. The pro-regime website Al Masdar News reported that the Syrian army withdrew from the farms of Al Maleh as they faced a rebel counter-offensive led by Al Nusra Front. It said rebels attacked government forces with two suicide car bombs. The observatory said two children were killed by regime bombs in a rebel-held area of Aleppo. The majority of Aleppo province is controlled by Al Nusra and its Islamist allies while the city the countrys pre-war commercial capital has been divided since July 2012 into rebel-held and regime-held areas. Five civilians including three children were also killed by regime bombs that landed on eastern Ghouta the observatory reported on Thursday.,jordantimes,07/01/2016,aleppo,1,,,,
1924058059,Syria rebels kill 7 in Aleppo assault capture 3 villages _ monitor | Jordan Times,Last updated at Jun 182016 BEIRUT At least seven people died in rebel shelling of a neighbourhood of the Syrian city of Aleppo held by the Kurdish YPG militia at dawn on Saturday a monitoring group said as rebels took territory to the south. More than 40 people were also wounded in the attack on the Sheikh Maqsoud area the Britain-based Syrian Observatory for Human Rights said a district next to the only way in and out of rebel-held parts of the northern city the Castello road. An escalation in air and artillery strikes in recent weeks around the road has made it virtually impassable putting hundreds of thousands of people in Aleppo under effective siege. Hundreds of people have been killed in Aleppo since peace talks broke off in April as Syrias President Bashar Assad seeks to regain control of what was Syrias largest pre-war city now split between rebel and government sectors. Rebels have said in the past their attacks on Sheikh Maqsoud were in response to YPG attempts to cut the Castello road. The YPG controls nearly all of Syrias northern frontier with Turkey and has been a close ally of the United States in the campaign against Daesh in Syria. Many rebels in western Syria do not trust the YPG because they say it cooperates with Damascus rather than fighting it an accusation the YPG has denied Heavy bombardment Sheikh Maqsoud has been under intense bombardment since mid-February which has killed more than 132 civilians and injured around 900 more the observatory said. A 48-hour ceasefire in Aleppo announced by Russia on Thursday has had little impact on fighting and air strikes and shelling have continued in and around the city since then. Three people two of them children died and more than nine people were injured by barrel bombs dropped from helicopters in the city the observatory said on Saturday. The White Helmets a group of civil defence emergency workers operating in rebel-held areas said on Twitter one of their buildings in Haritan in the north Aleppo countryside was hit by an air strike on Saturday. There were no injuries. The observatory also said on Saturday that rebels had captured three villages south of Aleppo from government control Zeitan Khalsa and Barna causing significant losses among government forces and their allies. The villages are near a main highway within rebel territory linking Aleppo with the capital Damascus to the south. They lie in an area captured by government forces at the end of last year in a large offensive assisted by Iranian-backed militias and Russian airpower. But the Syrian observatory said there has been a lack of Russian air support during this weeks battle for these villages. At least 86 members of Syrian government forces and its allies who include members of the Lebanese group Hizbollah and other Iranian-backed militias were killed in fighting in the south Aleppo area in the past four days the observatory said. The numbers could not be independently confirmed. The rebels are fighting alongside Al Qaeda-affiliated Al Nusra Front which like the Daesh terror group was excluded from a February ceasefire and from the Geneva peace talks.,jordantimes,6/15/2016,aleppo,1,,,,
1924058060,Raids on Syria market kill 21 hundreds flee Daesh bastion | Jordan Times,Last updated at Jun 132016 In this photo taken on June 8 provided by the Syrian Civil Defence Directorate in Liberated Province of Aleppo which has been authenticated based on its contents and other AP reporting shows Syrian civil defence workers (right) help an injured woman after warplanes attacked a street in Aleppo Syria (AP photo) BEIRUT Air strikes on a market in Syrias Al Qaeda-held city of Idlib killed at least 21 civilians Sunday as hundreds fled a besieged Daesh bastion near the Turkish border. Five children were among those killed in the air raids on Idlib which is held by Al Qaeda affiliate Al Nusra Front and its allies the Syrian Observatory for Human Rights said. Peace talks towards ending Syrias five-year war have stalled with no immediate end in sight to a conflict that has killed 280000 people. It was not clear who carried out the Idlib strikes but the observatory has reported previous air raids by the regime and its Russian ally on Idlib province which is also controlled by Al Nusra and rebel allies. Footage the observatory said was filmed after the Idlib strikes showed emergency workers training water hoses on a tall building amid a haze of smoke. In Maaret Al Numan an area south of the provincial capital unidentified warplanes also killed at least six civilians including a woman and her four children the observatory said. Russia launched air strikes in support of the Damascus regime in September allowing forces loyal to President Bashar Assad to advance against the rebels and Daesh. The Britain-based observatory relies on a wide network of sources inside Syria for its information. It says it determines what aircraft carried out raids based on their location flight patterns and the types of planes and munitions involved. The observatory said Russian air strikes killed 23 civilians in strikes on Idlib city on May 31 but Russia denied carrying out raids there that day. Suspected government strikes killed at least 37 civilians in Maaret Al Numan in April sparking condemnation from Syrias opposition amid faltering peace talks Civilians flee Daesh bastion Meanwhile hundreds of civilians escaped the Daesh stronghold of Manbij in nearby Aleppo province on Sunday helped by a US-backed Kurdish-Arab alliance surrounding the town. Tens of thousands had been trapped inside Manbij after the alliance encircled the town on Friday in a major blow to the terrorist group controlling it. Around 600 civilians fled on foot towards areas held by the Syrian Democratic Forces alliance south of the town observatory Chief Rami Abdel Rahman said. The SDF transported them to safer areas. Those still inside the town were terrified by heavy air strikes in the area Abdel Rahman said and food was becoming scarce after the SDF alliance blocked all roads in and out. At least 223 Daesh fighters and 28 SDF troops had been killed as well as 41 civilians in coalition air raids since the alliance offensive against Manbij began on May 31 according to the Observatory. Manbij lies at the heart of the last stretch of Daesh-controlled territory along Turkeys border. The siege has severed a key Daesh supply route that had channelled money and weapons from the Turkish border to the groups de facto Syrian capital of Raqqa city. Daesh has come under attack on several fronts since declaring a cross-border caliphate in Syria and Iraq in 2014. Millions of people have been displaced since Syrias civil war started in 2011 with the brutal repression of anti-government protests. Peace talks hit deadlock after the opposition walked out of negotiations in April over the escalating violence and lack of humanitarian access.,jordantimes,6/22/2016,idlib,1,,,,
1924058061,_28 dead in Daesh counterattack on Syria regime forces_ | Jordan Times,"Last updated at Jun 142016 BEIRUT A Daesh counterattack on Syrian regime forces advancing towards a militant stronghold on Monday left 28 militants dead a monitor said. Dozens of Daesh militants early on Monday attacked government positions south of the town of Tabaqa a Daesh stronghold on the Euphrates River said the Syrian Observatory for Human Rights. Observatory head Rami Abdel Rahman said fierce clashes broke out but that regime forces were able to maintain their positions and were still 15 kilometres from the Daesh-held Tabaqa airport. ""Eleven regime fighters and 17 Daesh fighters were killed in the attack"" said Abdel Rahman. Earlier this month government fighters backed by Russian air power began pushing north towards Tabaqa held by Daesh since 2014. The town lies some 50 kilometres east of the extremist groups Syrian de facto capital of Raqqa city and recapturing it would sever the supply road from the west. Last week Daesh militants had sent reinforcements of fighters and weapons into Tabaqa in anticipation of a fierce battle to defend the town. Abdel Rahman said a total of 37 government fighters and 101 Daesh militants have been killed since the regime launched its offensive for Tabaqa. The war in Syria which began with the brutal repression of anti-government demonstrations in 2011 has killed more than 280000 people and displaced millions. It has evolved into a brutal complex civil war among the government rebels extremists and Kurds each carving out zones of control.",jordantimes,06/07/2016,raqqa,0,,,,
1924058063,Syrian and Russian aircraft step up bombing of Aleppo city _ monitor | Jordan Times,"Last updated at Jun 062016 AMMAN Nearly 50 air strikes hit rebel-held areas in and around the Syrian city of Aleppo on Sunday in some of the heaviest recent raids by Russian and Syrian government aircraft residents and a monitoring group said. The group the Syrian Observatory for Human Rights also said an unidentified war plane had crashed in countryside south of Aleppo in an area where Islamist rebel fighters are battling the Syrian army and Iranian-backed forces. It had no information on what caused the crash. A civil defence worker said at least 32 people were killed in the rebel-held parts of the city during the air strikes with 18 bodies pulled from flattened buildings in the Qatrji neighbourhood the worst hit. The monitor said dozens of barrel bombs oil drums or cylinders packed with explosives and shrapnel were dropped by helicopter on densely populated districts. ""This week-long campaign of bombing is very intense and day by day its getting worse... it is the worst we have seen in a while"" said Bebars Mishal a civil defence official in rebel-held Aleppo. For their part rebels hit government-held areas of Aleppo in what Syrian media said was an escalation of mortar attacks on the western districts. State media said attacks on Sunday on Hamadaniyah Midan and other neighbourhoods by insurgents killed at least 20 people in the second day of intense shelling of government-held areas. The death toll over the whole weekend was at least 44. Aleppo the countrys largest city before the war has been divided for years between rebel and government-held zones. Full control of Aleppo would be a huge prize for President Bashar Assad. Russias military intervention since September has helped to bolster Assads government. In the northwestern province of Idlib meanwhile residents said Syrian and Russian jets bombed the rebel-held provincial capital setting fire to a bustling market in the heart of the city. More than 30 people were injured at least three killed and dozens were unaccounted for according to an activist contacted in the city. The Idlib strikes came just days after some of the heaviest raids on residential areas for months killing more than 30 people and injuring dozens on May 31. Idlib has been a relative haven for thousands of displaced Syrians. The air raids in Aleppo on Sunday came in the wake of strikes on civilian areas on Friday that residents said were the most intense in over a month. The Syrian Observatory said the Syrian government raids had targeted the main Castello road that leads into rebel-held Aleppo as part of a campaign to complete the encirclement of the citys insurgent-dominated areas. A Russian defence ministry statement on Sunday accused militant Syrian rebel groups of firing mortars on the mainly Kurdish-populated Sheikh Maqsood neighbourhood in Aleppo that overlooks the Castello road. The monitor said 13 people including six children were killed on Saturday in the Kurdish-run area by insurgents mortars. Rebels accuse the powerful Kurdish YPG of working with the Syrian army to cut the main artery by intensifying their ground attacks on the highway. The Russians had on Saturday accused militants from radical Islamic groups of bringing at least 1000 fighters into an area in the southern Aleppo countryside. The militants have consolidated gains since Friday in the area around the strategic town of Khan Touman rebels say. The Nusra Front spearheaded an attack on Khan Touman last month delivering one of the biggest battlefield setbacks yet to a coalition of foreign Shiite fighters supporting Syrian government forces. Rebels say Russian jets on Sunday pounded insurgent positions in the area to prevent them from advancing towards the nearby town of Hader which rebels say is a stronghold of Iranian-backed militias. Also US-backed forces on Sunday engaged with the Daesh terror groups militants in an offensive that began last Tuesday against the group-held areas in Aleppo province beginning with the Manbij area where they continued to seize more villages according to Kurdish sources and the monitor.",jordantimes,6/22/2016,aleppo,1,,,,
1924058064,Syria air strikes kill 22 mostly children outside school | Jordan Times,Last updated at Oct 262016 BEIRUT Air strikes in Syria killed up to 22 people mostly children on Wednesday when warplanes struck a residential area housing a school complex in the northern rebel-held province of Idlib activists and rescue workers said. A team of first responders the Syrian Civil Defence in Idlib said 22 people were killed and at least 50 wounded in the raids on the village of Hass. Most of those killed were children the group said in a post on its Facebook page. Another activist group the Britain-based Syrian Observatory for Human Rights gave the same death toll and said 14 children and a woman were among those killed. The activist-operated Idlib News network which gave a lower toll of 17 people killed said the strikes hit as the children were gathered outside the school complex. It said the death toll could rise as some of the wounded were reported to be in critical condition the network added. Idlib is the main Syrian opposition stronghold though radical groups also have a large presence there. It has regularly been hit by Syrian and Russian warplanes as well as the US-led coalition targeting Daesh militants. Footage posted by activists online shows a huge plume of smoke rising from the area of the strikes and rescuers rushing casualties away along a dusty road lined with destroyed buildings. A womans body is seen being carried on a stretcher while other bodies covered in cloth and one with only a hat lie under shrubs and other casualties are ferried away in pick-up trucks. An activist at the scene Muaz Al Shami said as many as 10 air strikes were believed to have hit the residential area. The video content couldnt be independently confirmed. However it conforms with AP reporting on the events depicted. Earlier in the day the northern Aleppo province saw a new escalation as a helicopter believed to belong to Syrian government forces dropped barrel bombs in a deadly attack on Turkey-backed opposition forces in the border area Turkish officials said. A statement attributed to the field commander of Syrias pro-government troops said any Turkish advances in northern Syria under the pretext of fighting Daesh militants would be dealt with forcefully and appropriately. The barrel bombing was said to have occurred in the village of Tal Madiq in a part of northern Aleppo where rival groups have been operating mostly to rout Daesh militants. If confirmed it would be the first attack by Syrian government forces on the Turkish-backed fighters. Turkeys state-run news agency didnt say when the attack occurred and said at least two Syrian opposition fighters were killed and five others wounded. A Syrian opposition spokesman said it took place Tuesday. The observatorys chief Rami Abdurrahman said helicopters struck as intense clashes were underway between Kurdish-led fighters and Turkey-backed forces in Tal Madiq and that 11 Syrian opposition fighters and five Kurdish fighters were killed. The Kurdish-led forces are now in control of the village about 16 kilometres from the highly prized Daesh-controlled town of Al Bab. A senior Kurdish commander however denied Syrian government bombings of the Turkey-backed fighters saying it was an attempted explanation for battlefield losses. They are trying to find a pretext for the loss. No aircraft were involved Mahmoud Barkhadan of the main Syria Kurdish militia the Peoples Protection Units told The Associated Press by telephone from the region. A spokesman for the Syrian fighting group Nour El Din El Zinki Yasser Al Youssef said the Kurdish-led forces attacked them while they were fighting Daesh militants in the area. Then Syrian government helicopters followed he said in a message. The complex terrain is a powder keg where confrontation among rival groups can break out anytime US-backed Syrian Kurdish fighters Turkey-backed Syrian rebels and Turkey. Ankara sent tanks troops and aircraft into northern Syria in August in an unprecedented incursion that it said was part of efforts to help Syrian opposition clear the border area of Daesh militants. But Ankara is also seeking to contain the US-backed Syrian Kurdish forces fighting Daesh putting it at odds with its key ally the United States. Ankara sees Kurdish fighters in Syria as an extension of its outlawed Kurdish militants and designated as a terrorist organisation. Syrias military threatened last week to shoot down any Turkish warplane that enters Syrian air space after Turkish jets raided villages in northern Syria in an escalation of Ankaras offensive against Kurdish fighters. On Wednesday a statement attributed to the field commander of pro-government troops said Turkish advance under the pretext of fighting Daesh in northern and eastern Aleppo is an encroachment on the Syrian governments area of operations and would not be tolerated. The fall of Al Bab to Turkey-backed rebels would threaten the governments siege on the rebels in the city of Aleppo to the west. Meanwhile Turkish Foreign Minister Mevlut Cavusoglu told reporters that Turkey is determined to push ahead with the offensive in northern Syria dubbed Operation Eurphrates Shield and capture Al Bab from Daesh militants. It would not be deterred by the bombing of Tal Madiq he said. Such attacks will not stop us from combatting Daesh Cavusoglu said. The Euphrates Shield operation will continue. The only goal of the Euphrates Shield operation is to clear Daesh from this area.,jordantimes,10/07/2016,idlib,1,,,,
1924058065,Syrian government push for Damascus rebel enclave kills at least 23 | Jordan Times,"Last updated at Nov 272017 BEIRUT An intensifying push by the Syrian government and allied forces to take the last major rebel stronghold near the capital Damascus killed at least 23 people on Sunday and injured many the Syrian Observatory for Human Rights said. The group said at least 127 people including 30 children have been killed by air strikes and shelling since the Syrian army backed by Russian jets began an offensive nearly two weeks ago to take the besieged rebel-held Eastern Ghouta area. Eastern Ghouta is one of several ""de-escalation"" zones across western Syria where Russia has brokered deals to ease the fighting between rebels and President Bashar Assads government. A Reuters witness said there had been drones in the sky since Sunday morning and warplanes had heavily bombarded the towns of Mesraba and Harasta. Heavy shelling also hit Eastern Ghouta and dozens had been injured. Assads forces have besieged Eastern Ghouta since 2012 and the area is suffering a humanitarian crisis. Ghouta residents are so short of food that they are eating trash fainting from hunger and forcing their children to eat on alternate days the UN World Food Programme said in a report this week. The opposition Eastern Ghouta Damascus Countryside local council said this week the escalating bombardment was forcing people to seek shelter in unsuitable and unsanitary places which it feared could lead to disease outbreaks. A number of shells from the rebel enclave have hit government-held Damascus in the past two weeks. Syrias six-year-old civil war has killed hundreds of thousands of people and forced millions to flee in the worst refugee crisis since World War II. UN-backed peace negotiations are due to begin in Geneva on November 28. Several previous rounds of Geneva talks have failed to agree a political transition for Syria or a way to stop the violence. Yahya Aridi spokesman for the Syrian opposition Geneva delegation said on Sunday it was now time for the Syrian government and the opposition to ""get to the table and start talking about transition from dictatorship to freedom"" in Geneva.",jordantimes,11/16/2017,damascus,1,,,,
1924058066,Air strikes kill 4 in Syria _truce zone_ _ monitor | Jordan Times,Last updated at Nov 022017 BEIRUT Syrian government air strikes killed at least four civilians including a child in a rebel-held town in a de-escalation zone outside the capital Damascus on Thursday a monitor said. The strikes hit the town of Douma which lies in the Eastern Ghouta region where a truce deal agreed by regime allies Iran and Russia and rebel backer Turkey has been in place since July. Despite the deal there has been an uptick in government bombardment of the area in recent days. Humanitarian groups have also warned of a malnutrition crisis in the area which is under a tight government siege. Regime planes fired rockets on several parts of Douma said Rami Abdel Rahman director of the Syrian Observatory for Human Rights a Britain-based monitor. Four civilians were killed including a child he said adding that 21 others were wounded. An AFP photographer saw some of the wounded being treated at a local medical facility where some of the dead were also being received. Ziad 13 suffered a head injury after being caught up in the strike on his way home. I was coming back from school when the first strike hit and I hid in a doorway he told AFP. The plane came back a second time and I tried to get down to the basement but the force of the second strike knocked the door closed and it injured my head and nose. Up to 400000 people are believed to live in Eastern Ghouta which has been under government siege since 2013. The blockade has caused serious food and medicine shortages and pushed the prices for what remains beyond the reach of impoverished residents. At least two children are reported to have died from malnourishment or related complications in recent weeks and more than 1100 other children are reportedly suffering acute malnutrition. On Monday several dozen trucks carrying assistance for 40000 people entered Eastern Ghouta as part of a United Nations-Syrian Arab Red Crescent convoy. It was the first aid access since September despite repeated requests from the UN and humanitarian actors for consistent access to besieged areas like Eastern Ghouta. On Tuesday 11 people including six school children were killed in regime shelling on the town of Jisreen in Eastern Ghouta the observatory said. More than 330000 people have been killed in Syria since the conflict began in March 2011 with anti-government protests.,jordantimes,11/02/2017,damascus,1,,,,
